{
  "change_id": "CHG-1042",
  "title": "Move configuration loading into its own module",
  "summary": "Refactors configuration loading into a smaller module without changing behavior.",
  "files_changed": [
    "src/config/__init__.py",
    "src/config/loader.py",
    "tests/test_config_loader.py"
  ]
}
